{
  "id": "pilates-side-kick",
  "nameKeys": {
    "enGB": "exercise.pilates_side_kick.name",
    "uk": "exercise.pilates_side_kick.name"
  },
  "discipline": "pilates",
  "movementPattern": "core_brace",
  "primaryMuscles": [
    "gluteus_medius",
    "obliques"
  ],
  "secondaryMuscles": [
    "quadriceps"
  ],
  "equipment": [
    "pilates_mat",
    "yoga_mat",
    "bodyweight"
  ],
  "level": "beginner",
  "unilateral": true,
  "mechanics": "isolation",
  "trackingType": "reps",
  "technique": [
    "Lie on side; prop head; kick top leg forward/back with control while torso stays still."
  ],
  "setup": [
    "Body in one long line; hand for support."
  ],
  "breathing": "Exhale on effort phases.",
  "commonMistakes": [
    "Rolling the torso back",
    "Swinging wildly"
  ],
  "safety": [
    "Small range first."
  ],
  "contraindications": [
    "Hip labral pain — modify"
  ],
  "regressions": [
    {
      "exerciseId": "side-plank",
      "note": "Isometric lateral"
    }
  ],
  "progressions": [],
  "evidenceRefs": [
    {
      "kind": "doi",
      "id": "10.1249/MSS.0b013e318213fefb",
      "label": "Garber et al. 2011 ACSM quantity/quality guidance",
      "supports": [
        "programming",
        "endurance",
        "mobility",
        "safety"
      ]
    }
  ],
  "media": {
    "illustrationKey": "media/illustrations/pilates-side-kick",
    "videoKey": "media/video/pilates-side-kick",
    "animationKey": "media/anim/pilates-side-kick"
  },
  "aliases": [],
  "tags": [
    "pilates"
  ]
}
